,number,value,datetime_start,datetime_complete,duration,params_C,params_gamma,state
0,0,0.5698642594251159,2026-06-25 19:57:10.508691,2026-06-25 19:57:19.197711,0 days 00:00:08.689020,0.001180381450209393,scale,COMPLETE
1,1,0.9894671555151147,2026-06-25 19:57:19.198209,2026-06-25 19:57:22.671155,0 days 00:00:03.472946,0.06907478300632829,scale,COMPLETE
2,2,1.0,2026-06-25 19:57:22.671596,2026-06-25 19:57:23.289756,0 days 00:00:00.618160,13.253354371956355,scale,COMPLETE
3,3,1.0,2026-06-25 19:57:23.290160,2026-06-25 19:57:23.899342,0 days 00:00:00.609182,97.90191207610633,scale,COMPLETE
4,4,1.0,2026-06-25 19:57:23.899808,2026-06-25 19:57:24.764753,0 days 00:00:00.864945,18.837080230232946,auto,COMPLETE
5,5,0.4128869725943929,2026-06-25 19:57:24.765218,2026-06-25 19:57:32.794329,0 days 00:00:08.029111,0.006565188883215999,auto,COMPLETE
6,6,1.0,2026-06-25 19:57:32.794802,2026-06-25 19:57:33.436060,0 days 00:00:00.641258,25.340048196194374,scale,COMPLETE
7,7,0.7175437727205403,2026-06-25 19:57:33.436631,2026-06-25 19:57:41.142694,0 days 00:00:07.706063,0.08136220110492827,auto,COMPLETE
8,8,0.9750075230164598,2026-06-25 19:57:41.143208,2026-06-25 19:57:45.810048,0 days 00:00:04.666840,0.04379666031077057,scale,COMPLETE
9,9,1.0,2026-06-25 19:57:45.810540,2026-06-25 19:57:46.701905,0 days 00:00:00.891365,0.762469231822972,scale,COMPLETE
10,10,1.0,2026-06-25 19:57:46.702359,2026-06-25 19:57:48.853020,0 days 00:00:02.150661,1.732257761773019,auto,COMPLETE
11,11,1.0,2026-06-25 19:57:48.853493,2026-06-25 19:57:49.460973,0 days 00:00:00.607480,92.94546839664154,scale,COMPLETE
12,12,1.0,2026-06-25 19:57:49.461433,2026-06-25 19:57:50.074275,0 days 00:00:00.612842,5.093373048623468,scale,COMPLETE
13,13,1.0,2026-06-25 19:57:50.074697,2026-06-25 19:57:50.686529,0 days 00:00:00.611832,80.81242239217868,scale,COMPLETE
14,14,1.0,2026-06-25 19:57:50.686976,2026-06-25 19:57:51.302468,0 days 00:00:00.615492,8.410681536957181,scale,COMPLETE
15,15,1.0,2026-06-25 19:57:51.302928,2026-06-25 19:57:52.146111,0 days 00:00:00.843183,0.8475488963481642,scale,COMPLETE
16,16,1.0,2026-06-25 19:57:52.146531,2026-06-25 19:57:52.769325,0 days 00:00:00.622794,3.0943865387485565,scale,COMPLETE
17,17,1.0,2026-06-25 19:57:52.769769,2026-06-25 19:57:53.373414,0 days 00:00:00.603645,28.463287897814727,scale,COMPLETE
18,18,0.9935126443879148,2026-06-25 19:57:53.373865,2026-06-25 19:57:58.642714,0 days 00:00:05.268849,0.39862262863394704,auto,COMPLETE
19,19,1.0,2026-06-25 19:57:58.643202,2026-06-25 19:57:59.281716,0 days 00:00:00.638514,10.02986693887086,scale,COMPLETE
20,20,1.0,2026-06-25 19:57:59.282155,2026-06-25 19:57:59.972238,0 days 00:00:00.690083,99.17800380305331,scale,COMPLETE
21,21,1.0,2026-06-25 19:57:59.972723,2026-06-25 19:58:00.755956,0 days 00:00:00.783233,27.509407127297845,auto,COMPLETE
22,22,1.0,2026-06-25 19:58:00.756378,2026-06-25 19:58:01.551091,0 days 00:00:00.794713,17.839943918380207,auto,COMPLETE
23,23,1.0,2026-06-25 19:58:01.551553,2026-06-25 19:58:02.292838,0 days 00:00:00.741285,46.618981023956785,auto,COMPLETE
24,24,1.0,2026-06-25 19:58:02.293250,2026-06-25 19:58:03.158215,0 days 00:00:00.864965,10.345472485592618,auto,COMPLETE
25,25,1.0,2026-06-25 19:58:03.158924,2026-06-25 19:58:04.572353,0 days 00:00:01.413429,3.3940290928896935,auto,COMPLETE
26,26,1.0,2026-06-25 19:58:04.572875,2026-06-25 19:58:05.338757,0 days 00:00:00.765882,37.534587597912584,auto,COMPLETE
27,27,1.0,2026-06-25 19:58:05.339180,2026-06-25 19:58:05.944895,0 days 00:00:00.605715,13.72285337277867,scale,COMPLETE
28,28,1.0,2026-06-25 19:58:05.945321,2026-06-25 19:58:08.071388,0 days 00:00:02.126067,1.636841526416537,auto,COMPLETE
29,29,1.0,2026-06-25 19:58:08.071805,2026-06-25 19:58:08.761748,0 days 00:00:00.689943,5.319625145640095,scale,COMPLETE
30,30,1.0,2026-06-25 19:58:08.762202,2026-06-25 19:58:09.370817,0 days 00:00:00.608615,49.147018775394166,scale,COMPLETE
31,31,0.5698642594251159,2026-06-25 19:58:09.371288,2026-06-25 19:58:17.490214,0 days 00:00:08.118926,0.001042727022962446,scale,COMPLETE
32,32,1.0,2026-06-25 19:58:17.490695,2026-06-25 19:58:18.113525,0 days 00:00:00.622830,21.207908195069297,scale,COMPLETE
33,33,1.0,2026-06-25 19:58:18.114138,2026-06-25 19:58:18.792079,0 days 00:00:00.677941,48.32859928537519,scale,COMPLETE
34,34,1.0,2026-06-25 19:58:18.792596,2026-06-25 19:58:19.419330,0 days 00:00:00.626734,18.722981432097846,scale,COMPLETE
35,35,0.653492169441391,2026-06-25 19:58:19.419761,2026-06-25 19:58:27.059198,0 days 00:00:07.639437,0.008401785621775563,scale,COMPLETE
36,36,1.0,2026-06-25 19:58:27.059707,2026-06-25 19:58:27.685494,0 days 00:00:00.625787,6.449937063079403,scale,COMPLETE
37,37,0.973575538978371,2026-06-25 19:58:27.685917,2026-06-25 19:58:34.520964,0 days 00:00:06.835047,0.1637824169160875,auto,COMPLETE
38,38,1.0,2026-06-25 19:58:34.521403,2026-06-25 19:58:35.177916,0 days 00:00:00.656513,2.555008001450723,scale,COMPLETE
39,39,0.4128869725943929,2026-06-25 19:58:35.178335,2026-06-25 19:58:45.024313,0 days 00:00:09.845978,0.0036252904983435984,auto,COMPLETE
40,40,1.0,2026-06-25 19:58:45.025157,2026-06-25 19:58:46.002882,0 days 00:00:00.977725,72.40173342647059,scale,COMPLETE
41,41,1.0,2026-06-25 19:58:46.003544,2026-06-25 19:58:47.503880,0 days 00:00:01.500336,0.6482953375215804,scale,COMPLETE
42,42,0.9754122571104953,2026-06-25 19:58:47.504644,2026-06-25 19:58:52.807237,0 days 00:00:05.302593,0.03878442544848815,scale,COMPLETE
43,43,0.9978776546145525,2026-06-25 19:58:52.807669,2026-06-25 19:58:54.914913,0 days 00:00:02.107244,0.13568547075302792,scale,COMPLETE
44,44,1.0,2026-06-25 19:58:54.915341,2026-06-25 19:58:55.757263,0 days 00:00:00.841922,0.8530151955936793,scale,COMPLETE
45,45,1.0,2026-06-25 19:58:55.757737,2026-06-25 19:58:56.478418,0 days 00:00:00.720681,1.3449514590859069,scale,COMPLETE
46,46,1.0,2026-06-25 19:58:56.478931,2026-06-25 19:58:57.083734,0 days 00:00:00.604803,12.1066406889305,scale,COMPLETE
47,47,1.0,2026-06-25 19:58:57.084147,2026-06-25 19:58:57.710527,0 days 00:00:00.626380,61.448678176470445,scale,COMPLETE
48,48,1.0,2026-06-25 19:58:57.710939,2026-06-25 19:58:58.319413,0 days 00:00:00.608474,28.071157018302948,scale,COMPLETE
49,49,1.0,2026-06-25 19:58:58.319815,2026-06-25 19:58:59.500270,0 days 00:00:01.180455,4.589696593468318,auto,COMPLETE
50,50,0.962218989174658,2026-06-25 19:58:59.500753,2026-06-25 19:59:06.421193,0 days 00:00:06.920440,0.02009220116285056,scale,COMPLETE
51,51,0.9735511493377593,2026-06-25 19:59:06.421688,2026-06-25 19:59:12.704211,0 days 00:00:06.282523,0.2333276775599099,auto,COMPLETE
52,52,1.0,2026-06-25 19:59:12.704728,2026-06-25 19:59:14.661413,0 days 00:00:01.956685,1.8405215960115342,auto,COMPLETE
53,53,0.9907848464070023,2026-06-25 19:59:14.661890,2026-06-25 19:59:20.012282,0 days 00:00:05.350392,0.36045610344231227,auto,COMPLETE
54,54,1.0,2026-06-25 19:59:20.012837,2026-06-25 19:59:21.104698,0 days 00:00:01.091861,7.362002407660651,auto,COMPLETE
55,55,1.0,2026-06-25 19:59:21.105172,2026-06-25 19:59:21.847578,0 days 00:00:00.742406,98.97301672269248,auto,COMPLETE
56,56,1.0,2026-06-25 19:59:21.848052,2026-06-25 19:59:22.666764,0 days 00:00:00.818712,15.137375998768059,auto,COMPLETE
57,57,1.0,2026-06-25 19:59:22.667234,2026-06-25 19:59:23.283626,0 days 00:00:00.616392,34.60133449885854,scale,COMPLETE
58,58,0.9984009404101173,2026-06-25 19:59:23.284086,2026-06-25 19:59:26.210122,0 days 00:00:02.926036,1.0254634238559068,auto,COMPLETE
59,59,1.0,2026-06-25 19:59:26.210597,2026-06-25 19:59:27.262088,0 days 00:00:01.051491,0.4777485821579043,scale,COMPLETE
60,60,1.0,2026-06-25 19:59:27.262566,2026-06-25 19:59:27.872801,0 days 00:00:00.610235,3.836260700715171,scale,COMPLETE
61,61,1.0,2026-06-25 19:59:27.873261,2026-06-25 19:59:28.481108,0 days 00:00:00.607847,64.8774075286965,scale,COMPLETE
62,62,1.0,2026-06-25 19:59:28.481556,2026-06-25 19:59:29.100235,0 days 00:00:00.618679,25.49086875974845,scale,COMPLETE
63,63,1.0,2026-06-25 19:59:29.100786,2026-06-25 19:59:29.770599,0 days 00:00:00.669813,39.76476573359013,scale,COMPLETE
64,64,1.0,2026-06-25 19:59:29.771015,2026-06-25 19:59:30.399614,0 days 00:00:00.628599,9.69735815564409,scale,COMPLETE
65,65,1.0,2026-06-25 19:59:30.400042,2026-06-25 19:59:31.037882,0 days 00:00:00.637840,2.3637134282893184,scale,COMPLETE
66,66,1.0,2026-06-25 19:59:31.038322,2026-06-25 19:59:31.830093,0 days 00:00:00.791771,18.111254337304263,auto,COMPLETE
67,67,1.0,2026-06-25 19:59:31.830541,2026-06-25 19:59:32.445560,0 days 00:00:00.615019,97.10058403104203,scale,COMPLETE
68,68,1.0,2026-06-25 19:59:32.446093,2026-06-25 19:59:33.176833,0 days 00:00:00.730740,52.30060076311017,auto,COMPLETE
69,69,1.0,2026-06-25 19:59:33.177300,2026-06-25 19:59:33.786797,0 days 00:00:00.609497,30.770907846037336,scale,COMPLETE
70,70,1.0,2026-06-25 19:59:33.787345,2026-06-25 19:59:34.406794,0 days 00:00:00.619449,7.220597386040129,scale,COMPLETE
71,71,1.0,2026-06-25 19:59:34.407218,2026-06-25 19:59:35.023408,0 days 00:00:00.616190,5.156702991212793,scale,COMPLETE
72,72,1.0,2026-06-25 19:59:35.023865,2026-06-25 19:59:35.686259,0 days 00:00:00.662394,2.7453783234072087,scale,COMPLETE
73,73,1.0,2026-06-25 19:59:35.686742,2026-06-25 19:59:36.314222,0 days 00:00:00.627480,13.42948424019368,scale,COMPLETE
74,74,1.0,2026-06-25 19:59:36.314675,2026-06-25 19:59:36.951430,0 days 00:00:00.636755,23.747995264316927,scale,COMPLETE
75,75,1.0,2026-06-25 19:59:36.951920,2026-06-25 19:59:37.711149,0 days 00:00:00.759229,1.2593209086842045,scale,COMPLETE
76,76,1.0,2026-06-25 19:59:37.711676,2026-06-25 19:59:38.323985,0 days 00:00:00.612309,9.844262865566314,scale,COMPLETE
77,77,1.0,2026-06-25 19:59:38.324505,2026-06-25 19:59:40.341623,0 days 00:00:02.017118,1.856400913511613,auto,COMPLETE
78,78,1.0,2026-06-25 19:59:40.342052,2026-06-25 19:59:41.032245,0 days 00:00:00.690193,38.54038536333187,scale,COMPLETE
79,79,1.0,2026-06-25 19:59:41.032773,2026-06-25 19:59:41.656165,0 days 00:00:00.623392,78.05999126209464,scale,COMPLETE
80,80,1.0,2026-06-25 19:59:41.656694,2026-06-25 19:59:43.043585,0 days 00:00:01.386891,3.5674323415350835,auto,COMPLETE
81,81,1.0,2026-06-25 19:59:43.044051,2026-06-25 19:59:43.654449,0 days 00:00:00.610398,52.38404700468609,scale,COMPLETE
82,82,1.0,2026-06-25 19:59:43.654971,2026-06-25 19:59:44.575188,0 days 00:00:00.920217,0.6445724595795049,scale,COMPLETE
83,83,1.0,2026-06-25 19:59:44.575597,2026-06-25 19:59:45.178173,0 days 00:00:00.602576,77.95667051221434,scale,COMPLETE
84,84,1.0,2026-06-25 19:59:45.178605,2026-06-25 19:59:45.774448,0 days 00:00:00.595843,20.095212898622304,scale,COMPLETE
85,85,1.0,2026-06-25 19:59:45.774905,2026-06-25 19:59:46.379510,0 days 00:00:00.604605,6.182065337036153,scale,COMPLETE
86,86,1.0,2026-06-25 19:59:46.379966,2026-06-25 19:59:46.989415,0 days 00:00:00.609449,13.972108077216527,scale,COMPLETE
87,87,1.0,2026-06-25 19:59:46.989904,2026-06-25 19:59:47.718845,0 days 00:00:00.728941,42.12977562230477,auto,COMPLETE
88,88,1.0,2026-06-25 19:59:47.719265,2026-06-25 19:59:48.326629,0 days 00:00:00.607364,58.78946301074928,scale,COMPLETE
89,89,1.0,2026-06-25 19:59:48.327068,2026-06-25 19:59:48.949238,0 days 00:00:00.622170,27.831836761160417,scale,COMPLETE
90,90,1.0,2026-06-25 19:59:48.949736,2026-06-25 19:59:49.688090,0 days 00:00:00.738354,83.90648142480329,auto,COMPLETE
91,91,1.0,2026-06-25 19:59:49.688647,2026-06-25 19:59:50.297687,0 days 00:00:00.609040,9.621056510876006,scale,COMPLETE
92,92,1.0,2026-06-25 19:59:50.298128,2026-06-25 19:59:50.921944,0 days 00:00:00.623816,4.35287805451189,scale,COMPLETE
93,93,1.0,2026-06-25 19:59:50.922429,2026-06-25 19:59:51.548240,0 days 00:00:00.625811,7.957215755404915,scale,COMPLETE
94,94,1.0,2026-06-25 19:59:51.548804,2026-06-25 19:59:52.176669,0 days 00:00:00.627865,16.73206117035973,scale,COMPLETE
95,95,1.0,2026-06-25 19:59:52.177203,2026-06-25 19:59:52.808027,0 days 00:00:00.630824,11.720008406326382,scale,COMPLETE
96,96,1.0,2026-06-25 19:59:52.808519,2026-06-25 19:59:54.102427,0 days 00:00:01.293908,0.3210288245691327,scale,COMPLETE
97,97,1.0,2026-06-25 19:59:54.102877,2026-06-25 19:59:54.894069,0 days 00:00:00.791192,23.67833963967314,auto,COMPLETE
98,98,1.0,2026-06-25 19:59:54.894481,2026-06-25 19:59:55.518929,0 days 00:00:00.624448,33.7906180764771,scale,COMPLETE
99,99,0.5698642594251159,2026-06-25 19:59:55.519490,2026-06-25 20:00:03.691356,0 days 00:00:08.171866,0.0015055975014411623,scale,COMPLETE
